{"$schema":"https://json-schema.org/draft/2020-12/schema","$id":"https://scs.invalid/schemas/intake-policy.schema.json","title":"SCS Intake Policy","type":"object","additionalProperties":false,"required":["schema_version","policy_status","execution_mode","canonical_store","steps","source_kinds","dispositions","duplicate_order","claim_statuses","task_statuses","context_statuses","priority_factors","auto_actions_allowed","require_review","require_separate_authorization","hard_rules"],"properties":{"schema_version":{"const":"scs.intake-policy.v1"},"policy_status":{"enum":["draft","active","deprecated"]},"execution_mode":{"const":"repository_native"},"canonical_store":{"const":"git_tracked_repository_artifacts"},"steps":{"type":"array","items":{"type":"string"},"minItems":10},"source_kinds":{"type":"array","items":{"type":"object","additionalProperties":false,"required":["kind","read_capability","trust_default"],"properties":{"kind":{"type":"string"},"read_capability":{"type":"string"},"trust_default":{"enum":["unreviewed","source_verified","corroborated","disputed","rejected"]}}}},"dispositions":{"type":"array","items":{"type":"string"},"minItems":1},"duplicate_order":{"type":"array","items":{"type":"string"},"minItems":1},"claim_statuses":{"type":"array","items":{"type":"string"},"minItems":1},"task_statuses":{"type":"array","items":{"type":"string"},"minItems":1},"context_statuses":{"type":"array","items":{"type":"string"},"minItems":1},"priority_factors":{"type":"array","items":{"type":"string"},"minItems":1},"auto_actions_allowed":{"type":"array","items":{"type":"string"}},"require_review":{"type":"array","items":{"type":"string"}},"require_separate_authorization":{"type":"array","items":{"type":"string"}},"hard_rules":{"type":"array","items":{"type":"string","minLength":1},"minItems":1}}}
